{
  "id": "mechanic.ignite",
  "type": "Mechanic",
  "name": {
    "ko": "점화",
    "en": "Ignite"
  },
  "tags": [
    "mechanic",
    "ailment"
  ],
  "data": {
    "keyword_stats": [
      "Ignite is an Ailment that deals Fire damage over time, and lasts for 4 seconds by default.",
      "The chance for a Hit to Ignite a target is determined by the total Magnitude of Flammability on the target, including the amount added by that Hit.",
      "Fire damage from Hits Contributes to the Magnitude of Ignite, so Hits dealing more Fire damage inflict stronger Ignites.",
      "The base Magnitude of Ignite is Fire damage per second equal to 20% of the Fire damage dealt by the Hit that inflicted it. This is calculated using the final damage dealt by the Hit, but not any modifiers on the target that affect how much damage they will take from the Hit. This Magnitude is not further affected by any modifiers to the damage you deal.",
      "Modifiers and Debuffs that affect the enemy's ability to mitigate damage (such as Shock ) can affect the damage the enemy takes from Ignite, but any such modifiers that specifically apply to Hit damage (such as Penetration ) do not affect Ignite damage."
    ],
    "elemental": true,
    "damaging": true,
    "scales_from": [
      "Fire"
    ],
    "damage_type": "Fire",
    "can_stack": true,
    "max_stacks_default": 1,
    "can_stack_sources": [
      "Modules/ModParser.lua"
    ],
    "constants": {
      "BaseIgniteDuration": 4,
      "IgniteChanceMultiplier": 20,
      "IgniteHitDamagePercentPerMinute": 1200,
      "IgniteNonHitFlammabilityModifier": 0.8,
      "NonHitFlammabilityPermyriadThresholdToIgnite": 5000
    },
    "kind": "ailment",
    "note": "점화는 **Fire 피해에서만 스케일한다** — 다른 속성의 피해 증가는 반영되지 않는다"
  },
  "verification": "POB_CODE",
  "sources": [
    {
      "src": "pob",
      "ref": "Modules/Data.lua (ailmentTypeList·defaultAilmentDamageTypes·buildupTypes) · Data/Misc.lua (gameConstants)",
      "patch": "0.5.4b",
      "pob": "5d173cbf8c9cf394a975cbb813f19d0b6dc67ea6"
    }
  ]
}
