{
  "id": "mechanic.accuracy",
  "type": "Mechanic",
  "name": {
    "ko": "Accuracy",
    "en": "Accuracy"
  },
  "tags": [
    "mechanic",
    "keyword"
  ],
  "data": {
    "kind": "keyword",
    "stats": [
      "Accuracy is used to hit a target with an Attack, and is checked against the targets Evasion to determine that chance.",
      "Player Attacks incur an Accuracy penalty based on distance from the origin of the damage to the target, with no penalty for targets within 2 metres and up to 90% less Accuracy for targets further than 9 metres away."
    ]
  },
  "verification": "GAME_DATA",
  "sources": [
    {
      "src": "poe2db",
      "ref": "https://poe2db.tw/us/Accuracy",
      "patch": "0.5.4b"
    }
  ]
}
