{
  "id": "mechanic.jade",
  "type": "Mechanic",
  "name": {
    "ko": "Jade",
    "en": "Jade"
  },
  "tags": [
    "mechanic",
    "keyword"
  ],
  "data": {
    "kind": "keyword",
    "stats": [
      "Jade is a stacking Buff which grants 1% additional Physical Damage Reduction per stack. Maximum of 10 Jade stacks."
    ]
  },
  "verification": "GAME_DATA",
  "sources": [
    {
      "src": "poe2db",
      "ref": "https://poe2db.tw/us/Jade",
      "patch": "0.5.4b"
    }
  ]
}
