{
  "id": "mechanic.default-attack-damage",
  "type": "Mechanic",
  "name": {
    "ko": "Default Attack Damage",
    "en": "Default Attack Damage"
  },
  "tags": [
    "mechanic",
    "keyword"
  ],
  "data": {
    "kind": "keyword",
    "stats": [
      "Your Default Attack Damage is the expected damage of a Default Attack, and is determined by the damage of your Weapon and an Attack Damage scaling value based on your character level.",
      "Your Default Attacks will always deal Default Attack Damage unless modifiers are applied to change their damage or skill level.",
      "Some Attack skills provided by Support Gems do not determine their Attack Damage scaling from skill level, but instead deal a percentage of Default Attack Damage."
    ],
    "keyword_stats": [
      "Your Default Attack Damage is the expected damage of a Default Attack, and is determined by the damage of your Weapon and an Attack Damage scaling value based on your character level.",
      "Your Default Attacks will always deal Default Attack Damage unless modifiers are applied to change their damage or skill level.",
      "Some Attack skills provided by Support Gems do not determine their Attack Damage scaling from skill level, but instead deal a percentage of Default Attack Damage."
    ]
  },
  "verification": "GAME_DATA",
  "sources": [
    {
      "src": "poe2db",
      "ref": "https://poe2db.tw/us/Default_Attack_Damage",
      "patch": "0.5.4b"
    }
  ]
}
