{
  "id": "mechanic.fork",
  "type": "Mechanic",
  "name": {
    "ko": "Fork",
    "en": "Fork"
  },
  "tags": [
    "mechanic",
    "keyword"
  ],
  "data": {
    "kind": "keyword",
    "stats": [
      "Projectiles that Fork split into two the first time they collide with an enemy and do not Split from it or Pierce it."
    ]
  },
  "verification": "GAME_DATA",
  "sources": [
    {
      "src": "poe2db",
      "ref": "https://poe2db.tw/us/Fork",
      "patch": "0.5.4b"
    }
  ]
}
