{
  "id": "mechanic.unholy-might",
  "type": "Mechanic",
  "name": {
    "ko": "Unholy Might",
    "en": "Unholy Might"
  },
  "tags": [
    "mechanic",
    "keyword"
  ],
  "data": {
    "kind": "keyword",
    "stats": [
      "Unholy Might is a Buff that grants 30% of all damage as extra Chaos Damage."
    ]
  },
  "verification": "GAME_DATA",
  "sources": [
    {
      "src": "poe2db",
      "ref": "https://poe2db.tw/us/Unholy_Might",
      "patch": "0.5.4b"
    }
  ]
}
