{
  "id": "mechanic.minions",
  "type": "Mechanic",
  "name": {
    "ko": "Minions",
    "en": "Minions"
  },
  "tags": [
    "mechanic",
    "keyword"
  ],
  "data": {
    "kind": "keyword",
    "stats": [
      "Minions are summoned Allies which will accompany and fight alongside you. Persistent Minions will reserve a portion of Spirit while active."
    ]
  },
  "verification": "GAME_DATA",
  "sources": [
    {
      "src": "poe2db",
      "ref": "https://poe2db.tw/us/Minions",
      "patch": "0.5.4b"
    }
  ]
}
