{
  "id": "mechanic.bleed",
  "type": "Mechanic",
  "name": {
    "ko": "출혈",
    "en": "Bleed"
  },
  "tags": [
    "mechanic",
    "ailment"
  ],
  "data": {
    "elemental": false,
    "damaging": true,
    "scales_from": [
      "Physical"
    ],
    "damage_type": "Physical",
    "constants": {
      "BaseBleedingDuration": 5,
      "BaseBloodstainedAfterBleedingDuration": 6,
      "BleedingHitDamagePercentPerMinute": 900,
      "BloodstainedMultiplierWhenMovingOrBleedingAggravated": 2,
      "no_extra_bleeding_damage_while_moving": 1
    },
    "kind": "ailment",
    "note": "출혈은 **Physical 피해에서만 스케일한다** — 다른 속성의 피해 증가는 반영되지 않는다"
  },
  "verification": "POB_CODE",
  "sources": [
    {
      "src": "pob",
      "ref": "Modules/Data.lua (ailmentTypeList·defaultAilmentDamageTypes·buildupTypes) · Data/Misc.lua (gameConstants)",
      "patch": "0.5.4b",
      "pob": "5d173cbf8c9cf394a975cbb813f19d0b6dc67ea6"
    }
  ]
}
